{
  "id": 12521250,
  "name": "ARIZONA LIBERTARIAN PARTY ; Michael Kielsky, Plaintiffs-Appellants, v. Katie HOBBS, in her official capacity as Secretary of State of Arizona, Defendant-Appellee.",
  "name_abbreviation": "Ariz. Libertarian Party v. Hobbs",
  "decision_date": "2019-05-31",
  "docket_number": "No. 17-16491",
  "first_page": "1085",
  "last_page": "1097",
  "citations": [
    {
      "type": "official",
      "cite": "925 F.3d 1085"
    }
  ],
  "court": {
    "name_abbreviation": "9th Cir.",
    "id": 18869,
    "name": "United States Court of Appeals for the Ninth"
  },
  "jurisdiction": {
    "id": 39,
    "name_long": "United States",
    "name": "U.S."
  },
  "cites_to": [
    {
      "cite": "Ariz. Rev. Stat. \u00a7 16-645",
      "category": "laws:leg_statute",
      "reporter": "Ariz. Rev. Stat.",
      "pin_cites": [
        {
          "page": "(D)"
        }
      ],
      "opinion_index": 0
    },
    {
      "cite": "688 N.W.2d 854",
      "category": "reporters:state_regional",
      "reporter": "N.W.2d",
      "case_ids": [
        9165957
      ],
      "weight": 3,
      "year": 2004,
      "pin_cites": [
        {
          "page": "859-61"
        },
        {
          "page": "859-61"
        },
        {
          "page": "861"
        }
      ],
      "opinion_index": 0,
      "case_paths": [
        "/nw2d/688/0854-01"
      ]
    },
    {
      "cite": "633 F. Supp. 877",
      "category": "reporters:federal",
      "reporter": "F. Supp.",
      "case_ids": [
        3857371
      ],
      "year": 1986,
      "pin_cites": [
        {
          "page": "883"
        }
      ],
      "opinion_index": 0,
      "case_paths": [
        "/f-supp/633/0877-01"
      ]
    },
    {
      "cite": "479 U.S. 208",
      "category": "reporters:federal",
      "reporter": "U.S.",
      "case_ids": [
        6213947
      ],
      "weight": 3,
      "year": 1986,
      "pin_cites": [
        {
          "page": "213-29"
        }
      ],
      "opinion_index": 0,
      "case_paths": [
        "/us/479/0208-01"
      ]
    },
    {
      "cite": "834 F.3d 620",
      "category": "reporters:federal",
      "reporter": "F.3d",
      "case_ids": [
        6056013
      ],
      "year": 2016,
      "pin_cites": [
        {
          "page": "623",
          "parenthetical": "rejecting an argument \"creat[ing] a 'one-way ratchet' that would discourage states from\" increasing ballot access, \"lest they be prohibited by federal courts from later modifying their election procedures in response to changing circumstances\""
        }
      ],
      "opinion_index": 0,
      "case_paths": [
        "/f3d/834/0620-01"
      ]
    },
    {
      "cite": "440 U.S. 173",
      "category": "reporters:federal",
      "reporter": "U.S.",
      "case_ids": [
        6180624
      ],
      "weight": 5,
      "year": 1979,
      "pin_cites": [
        {
          "page": "186-87"
        },
        {
          "page": "183-87"
        }
      ],
      "opinion_index": 0,
      "case_paths": [
        "/us/440/0173-01"
      ]
    },
    {
      "cite": "351 F.3d 1277",
      "category": "reporters:federal",
      "reporter": "F.3d",
      "case_ids": [
        9054431
      ],
      "weight": 2,
      "year": 2003,
      "pin_cites": [
        {
          "page": "1282"
        },
        {
          "page": "1282"
        }
      ],
      "opinion_index": 0,
      "case_paths": [
        "/f3d/351/1277-01"
      ]
    },
    {
      "cite": "530 U.S. 567",
      "category": "reporters:federal",
      "reporter": "U.S.",
      "case_ids": [
        9413964
      ],
      "weight": 5,
      "year": 2000,
      "pin_cites": [
        {
          "page": "577, 581-82, 586"
        },
        {
          "page": "584"
        }
      ],
      "opinion_index": 0,
      "case_paths": [
        "/us/530/0567-01"
      ]
    },
    {
      "cite": "413 U.S. 548",
      "category": "reporters:federal",
      "reporter": "U.S.",
      "case_ids": [
        11342106
      ],
      "weight": 3,
      "year": 1973,
      "pin_cites": [
        {
          "page": "567"
        }
      ],
      "opinion_index": 0,
      "case_paths": [
        "/us/413/0548-01"
      ]
    },
    {
      "cite": "640 F.3d 1098",
      "category": "reporters:federal",
      "reporter": "F.3d",
      "case_ids": [
        4204224
      ],
      "weight": 2,
      "year": 2011,
      "pin_cites": [
        {
          "page": "1114"
        },
        {
          "page": "1114",
          "parenthetical": "recognizing regulations need not be \"narrowly tailored\""
        }
      ],
      "opinion_index": 0,
      "case_paths": [
        "/f3d/640/1098-01"
      ]
    },
    {
      "cite": "321 U.S. 649",
      "category": "reporters:federal",
      "reporter": "U.S.",
      "case_ids": [
        301825
      ],
      "weight": 3,
      "year": 1944,
      "pin_cites": [
        {
          "page": "660"
        }
      ],
      "opinion_index": 0,
      "case_paths": [
        "/us/321/0649-01"
      ]
    },
    {
      "cite": "836 F.3d 1019",
      "category": "reporters:federal",
      "reporter": "F.3d",
      "case_ids": [
        4354488
      ],
      "year": 2016,
      "pin_cites": [
        {
          "page": "1026",
          "parenthetical": "quoting Smith v. Allwright , 321 U.S. 649, 660, 64 S.Ct. 757, 88 L.Ed. 987 (1944) "
        }
      ],
      "opinion_index": 0,
      "case_paths": [
        "/f3d/836/1019-01"
      ]
    },
    {
      "cite": "479 U.S. 189",
      "category": "reporters:federal",
      "reporter": "U.S.",
      "case_ids": [
        6213568
      ],
      "weight": 11,
      "year": 1986,
      "pin_cites": [
        {
          "page": "196-97"
        },
        {
          "page": "194-95"
        },
        {
          "page": "193-94"
        },
        {
          "page": "194-95"
        },
        {
          "page": "198"
        }
      ],
      "opinion_index": 0,
      "case_paths": [
        "/us/479/0189-01"
      ]
    },
    {
      "cite": "125 S.Ct. 2029",
      "category": "reporters:federal",
      "reporter": "S. Ct.",
      "case_ids": [
        5872036
      ],
      "weight": 4,
      "pin_cites": [
        {
          "page": "586-97"
        }
      ],
      "opinion_index": 0,
      "case_paths": [
        "/us/544/0581-01"
      ]
    },
    {
      "cite": "620 F.3d 1214",
      "category": "reporters:federal",
      "reporter": "F.3d",
      "case_ids": [
        3781582
      ],
      "weight": 5,
      "year": 2010,
      "pin_cites": [
        {
          "page": "1217"
        },
        {
          "page": "1218"
        },
        {
          "page": "1217",
          "parenthetical": "internal quotations and citation omitted"
        },
        {
          "page": "1218-19"
        },
        {
          "page": "1218"
        }
      ],
      "opinion_index": 0,
      "case_paths": [
        "/f3d/620/1214-01"
      ]
    },
    {
      "cite": "94 S.Ct. 1296",
      "category": "reporters:federal",
      "reporter": "S. Ct.",
      "case_ids": [
        6181380
      ],
      "weight": 13,
      "opinion_index": 0,
      "case_paths": [
        "/us/415/0767-01"
      ]
    },
    {
      "cite": "393 U.S. 23",
      "category": "reporters:federal",
      "reporter": "U.S.",
      "case_ids": [
        11309544
      ],
      "weight": 11,
      "year": 1968,
      "pin_cites": [
        {
          "page": "24-25",
          "parenthetical": "invalidating 15% requirement"
        },
        {
          "parenthetical": "invalidating 15% requirement"
        },
        {
          "parenthetical": "invalidating 15% requirement"
        },
        {
          "page": "24-25, 30-34"
        },
        {
          "page": "25"
        },
        {
          "page": "24-25"
        }
      ],
      "opinion_index": 0,
      "case_paths": [
        "/us/393/0023-01"
      ]
    },
    {
      "cite": "403 U.S. 431",
      "category": "reporters:federal",
      "reporter": "U.S.",
      "case_ids": [
        12027224
      ],
      "weight": 24,
      "year": 1971,
      "pin_cites": [
        {
          "page": "442"
        },
        {
          "page": "442"
        },
        {
          "parenthetical": "invalidating 15% requirement"
        },
        {
          "page": "438-40, 442"
        },
        {
          "page": "434, 438"
        },
        {
          "page": "442"
        },
        {
          "page": "442"
        },
        {
          "page": "440-41"
        },
        {
          "page": "440-41"
        },
        {
          "page": "432-33"
        },
        {
          "page": "438"
        },
        {
          "page": "438-39"
        }
      ],
      "opinion_index": 0,
      "case_paths": [
        "/us/403/0431-01"
      ]
    },
    {
      "cite": "520 U.S. 351",
      "category": "reporters:federal",
      "reporter": "U.S.",
      "case_ids": [
        11651911
      ],
      "weight": 11,
      "year": 1997,
      "pin_cites": [
        {
          "page": "358",
          "parenthetical": "quoting Burdick , 504 U.S. at 434, 112 S.Ct. 2059 "
        },
        {
          "parenthetical": "quoting Burdick , 504 U.S. at 434, 112 S.Ct. 2059 "
        },
        {
          "parenthetical": "quoting Burdick , 504 U.S. at 434, 112 S.Ct. 2059 "
        },
        {
          "page": "363"
        },
        {
          "page": "358"
        },
        {
          "page": "358"
        },
        {
          "page": "358"
        }
      ],
      "opinion_index": 0,
      "case_paths": [
        "/us/520/0351-01"
      ]
    },
    {
      "cite": "112 S.Ct. 698",
      "category": "reporters:federal",
      "reporter": "S. Ct.",
      "case_ids": [
        6225194
      ],
      "weight": 7,
      "year": 1997,
      "pin_cites": [
        {
          "parenthetical": "quoting Burdick , 504 U.S. at 434, 112 S.Ct. 2059 "
        },
        {
          "page": "288"
        }
      ],
      "opinion_index": 0,
      "case_paths": [
        "/us/502/0279-01"
      ]
    },
    {
      "cite": "504 U.S. 428",
      "category": "reporters:federal",
      "reporter": "U.S.",
      "case_ids": [
        11729479
      ],
      "weight": 9,
      "year": 1992,
      "pin_cites": [
        {
          "page": "434"
        },
        {
          "page": "434"
        },
        {
          "page": "434"
        }
      ],
      "opinion_index": 0,
      "case_paths": [
        "/us/504/0428-01"
      ]
    },
    {
      "cite": "460 U.S. 780",
      "category": "reporters:federal",
      "reporter": "U.S.",
      "case_ids": [
        6200638
      ],
      "weight": 9,
      "year": 1983,
      "pin_cites": [
        {
          "page": "789"
        },
        {
          "page": "790-94"
        },
        {
          "page": "788-89"
        }
      ],
      "opinion_index": 0,
      "case_paths": [
        "/us/460/0780-01"
      ]
    },
    {
      "cite": "415 U.S. 724",
      "category": "reporters:federal",
      "reporter": "U.S.",
      "case_ids": [
        6180873
      ],
      "weight": 21,
      "year": 1974,
      "pin_cites": [
        {
          "page": "729-30"
        },
        {
          "page": "739-40"
        },
        {
          "parenthetical": "invalidating 15% requirement"
        },
        {
          "page": "739-40"
        },
        {
          "page": "774-91"
        },
        {
          "page": "782"
        },
        {
          "page": "740"
        },
        {
          "page": "778-81"
        },
        {
          "page": "784"
        },
        {
          "page": "735"
        },
        {
          "page": "787"
        },
        {
          "page": "788"
        },
        {
          "page": "781"
        },
        {
          "page": "781"
        },
        {
          "page": "781-82"
        }
      ],
      "opinion_index": 0,
      "case_paths": [
        "/us/415/0724-01"
      ]
    },
    {
      "cite": "Ariz. Rev. Stat. \u00a7 16-467",
      "category": "laws:leg_statute",
      "reporter": "Ariz. Rev. Stat.",
      "opinion_index": 0
    },
    {
      "cite": "Ariz. Rev. Stat. \u00a7\u00a7 16-316",
      "category": "laws:leg_statute",
      "reporter": "Ariz. Rev. Stat.",
      "opinion_index": 0
    },
    {
      "cite": "Ariz. Rev. Stat. \u00a7\u00a7 16-803",
      "category": "laws:leg_statute",
      "reporter": "Ariz. Rev. Stat.",
      "opinion_index": 0
    },
    {
      "cite": "Ariz. Rev. Stat. \u00a7\u00a7 16-801",
      "category": "laws:leg_statute",
      "reporter": "Ariz. Rev. Stat.",
      "weight": 3,
      "pin_cites": [
        {
          "page": "(A)"
        },
        {
          "page": "(B)"
        }
      ],
      "opinion_index": 0
    },
    {
      "cite": "Ariz. Rev. Stat. \u00a7 16-321",
      "category": "laws:leg_statute",
      "reporter": "Ariz. Rev. Stat.",
      "weight": 3,
      "pin_cites": [
        {
          "page": "(F)"
        },
        {
          "page": "(A)"
        }
      ],
      "opinion_index": 0
    },
    {
      "cite": "Ariz. Rev. Stat. \u00a7 16-322",
      "category": "laws:leg_statute",
      "reporter": "Ariz. Rev. Stat.",
      "weight": 4,
      "year": 2015,
      "pin_cites": [
        {
          "page": "(A)"
        },
        {
          "page": "(C)"
        },
        {
          "page": "(A)(1)"
        }
      ],
      "opinion_index": 0
    },
    {
      "cite": "Ariz. Rev. Stat. \u00a7 16-804",
      "category": "laws:leg_statute",
      "reporter": "Ariz. Rev. Stat.",
      "weight": 2,
      "pin_cites": [
        {
          "parenthetical": "applying to state, county, city, and town elections"
        }
      ],
      "opinion_index": 0
    },
    {
      "cite": "531 F.3d 1028",
      "category": "reporters:federal",
      "reporter": "F.3d",
      "case_ids": [
        5871099
      ],
      "year": 2008,
      "opinion_index": 0,
      "case_paths": [
        "/f3d/531/1028-01"
      ]
    },
    {
      "cite": "838 F.3d 983",
      "category": "reporters:federal",
      "reporter": "F.3d",
      "case_ids": [
        12174389
      ],
      "weight": 2,
      "year": 2016,
      "pin_cites": [
        {
          "page": "988"
        }
      ],
      "opinion_index": 0,
      "case_paths": [
        "/f3d/838/0983-01"
      ]
    }
  ],
  "analysis": {
    "cardinality": 1286,
    "char_count": 33826,
    "pagerank": {
      "raw": 4.89950402824256e-08,
      "percentile": 0.30901936753841636
    },
    "sha256": "8ce4c6c364e586aaa3b89e8fb4fd488814e0251751044e1d54741870d0a06f53",
    "simhash": "1:bc4b8b246f5fb3a2",
    "word_count": 5140
  },
  "last_updated": "2024-02-27T18:46:49.974673+00:00",
  "provenance": {
    "date_added": "2021-08-27",
    "source": "Fastcase",
    "batch": "2021"
  },
  "casebody": {
    "judges": [],
    "parties": [
      "ARIZONA LIBERTARIAN PARTY ; Michael Kielsky, Plaintiffs-Appellants,\nv.\nKatie HOBBS, in her official capacity as Secretary of State of Arizona, Defendant-Appellee."
    ],
    "opinions": [
      {
        "text": "McKEOWN, Circuit Judge:\nOnce again, we have before us a challenge to Arizona's requirements to earn a place on the ballot. See, e.g. , Ariz. Green Party v. Reagan , 838 F.3d 983 (9th Cir. 2016) ; Nader v. Brewer , 531 F.3d 1028 (9th Cir. 2008). The Arizona Libertarian Party challenges under the First and Fourteenth Amendments a state law requiring up to 1% of voters eligible to participate in its primary to sign a nominating petition for a Libertarian candidate to earn a place on the primary ballot. The district court granted summary judgment to the Arizona Secretary of State (the \"Secretary\"), and we affirm.\nBACKGROUND\nUnder Arizona law, there are two types of political parties: \"established\" parties and \"new\" parties. A party is \"established\" in a jurisdiction if it (i) obtained at least 5% of the total votes cast in the prior general election, or (ii) maintains membership exceeding 0.66% of registered voters in that jurisdiction. Ariz. Rev. Stat. \u00a7 16-804 (applying to state, county, city, and town elections). An established party is entitled to \"continued representation\" on the general election ballot. Id. The Libertarian, Democratic, and Republican Parties are established statewide.\nBefore 2016, to qualify for the primary ballot, an established party candidate needed to submit signatures exceeding a certain percentage (ranging between 0.5% and 2%, depending on the office sought) of the party's registered voters in the jurisdiction where he sought election. Ariz. Rev. Stat. \u00a7 16-322(A) (2015). A candidate was permitted to submit signatures from party members, members of any new party, or unaffiliated registered voters. Id. \u00a7 16-321(D).\nIn 2015, the Arizona legislature amended the signature requirements for established party candidates. 2015 Ariz. Sess. Laws Ch. 293, \u00a7\u00a7 2-3 (H.B. 2608). Now, to qualify for a primary ballot, an established party candidate must submit signatures exceeding a certain percentage of \"qualified signer[s],\" which include the party's registered voters, as well as all new party voters and unaffiliated registered voters. Ariz. Rev. Stat. \u00a7 16-321(F). The amendments reduced the signature threshold for each office to between 0.25% and 1%. Id. \u00a7 16-322(A). In 2016-the first election governed by the amended rules-there were significantly fewer Libertarian candidates on the primary and general election ballots than in prior elections. See generally Ariz. Sec. of State, Historical Election Results & Information , https://azsos.gov/elections/voter-registration-historical-election-data/historical-election-results-information (last visited May 7, 2019) (collecting data for recent Arizona elections).\nA \"new\" party is subject to different rules. A new party must first submit a petition for recognition and signatures from eligible voters exceeding 1.33% of total votes cast statewide in the prior gubernatorial election. Ariz. Rev. Stat. \u00a7\u00a7 16-801(A), 16-803. After doing so, the party's candidates are eligible to pursue placement on the primary and general election ballots for the next four years. Ariz. Rev. Stat. \u00a7 16-801(B). To retain its recognition and ballot eligibility at the end of the four years, the party must either qualify as an established party or file another petition for recognition and the accompanying signatures. Id. ; see Ariz. Rev. Stat. \u00a7\u00a7 16-803 -04.\nTo qualify for the primary ballot, a new party candidate must submit signatures exceeding 0.1% \"of the total vote for the winning candidate or candidates for governor or presidential electors at the last general election within the district.\" Ariz. Rev. Stat. \u00a7 16-322(C). The Arizona Green Party first qualified as a new party in 1990, and, never having qualified as an established party, has successfully re-filed petitions for new party recognition and the accompanying signatures several times, most recently in 2014. Since the beginning of 2017, Arizona has permitted digital solicitation and streamlined submission of voter signatures through an online portal. Ariz. Rev. Stat. \u00a7\u00a7 16-316 -18.\nUnder Arizona law, an established party member may not vote in another party's primary, but it is up to the established parties to decide whether new party members or unaffiliated voters can participate in their primaries. See Ariz. Rev. Stat. \u00a7 16-467. The Libertarian Party excludes such voters, while the Democratic and Republican Parties do not.\nIn April 2016, the Libertarian Party and its chairman Michael Kielsky (collectively, the \"Libertarian Party\") filed this action challenging the primary signature requirements. The district court denied the Libertarian Party's request for a preliminary injunction prohibiting enforcement of the amended requirements for the 2016 election. The parties filed cross-motions for summary judgment, and, in July 2017, the district court granted summary judgment to the Secretary.\nANALYSIS\nThe Libertarian Party contends that Arizona's ballot access scheme violates equal protection and infringes upon the right to place its candidates on the ballot and the right to free association. Only the rules governing access to the primary election ballot are at issue on this appeal-the Libertarian Party does not call into question the rules for earning a place on the general election ballot. With that in mind, we first set forth the balancing framework that guides our review and then explain why Arizona's rules for accessing the primary ballot are constitutionally sound.\nI. The Anderson /Burdick Balancing Framework\nThere is an inevitable tension between a state's authority and need to regulate its elections and the First and Fourteenth Amendment rights of voters, candidates, and political parties. See Storer v. Brown , 415 U.S. 724, 729-30, 94 S.Ct. 1274, 39 L.Ed.2d 714 (1974). To harmonize these competing demands, we look to Anderson v. Celebrezze , 460 U.S. 780, 103 S.Ct. 1564, 75 L.Ed.2d 547 (1983), and Burdick v. Takushi , 504 U.S. 428, 112 S.Ct. 2059, 119 L.Ed.2d 245 (1992), which provide a \"flexible standard\" for reviewing constitutional challenges to state election regulations:\nA court considering a challenge to a state election law must weigh \"the character and magnitude of the asserted injury to the rights protected by the First and Fourteenth Amendments that the plaintiff seeks to vindicate\" against \"the precise interests put forward by the State as justifications for the burden imposed by its rule,\" taking into consideration \"the extent to which those interests make it necessary to burden the plaintiff's rights.\"\nBurdick , 504 U.S. at 434, 112 S.Ct. 2059 (quoting Anderson , 460 U.S. at 789, 103 S.Ct. 1564 ). We have described this approach as a \"sliding scale\"-the more severe the burden imposed, the more exacting our scrutiny; the less severe, the more relaxed our scrutiny. Ariz. Green Party , 838 F.3d at 988. To pass constitutional muster, a state law imposing a severe burden must be narrowly tailored to advance \"compelling\" interests. Norman , 502 U.S. at 289, 112 S.Ct. 698. On the other hand, a law imposing a minimal burden need only reasonably advance \"important\" interests. Timmons v. Twin Cities Area New Party , 520 U.S. 351, 358, 117 S.Ct. 1364, 137 L.Ed.2d 589 (1997) (quoting Burdick , 504 U.S. at 434, 112 S.Ct. 2059 ).\nWe now consider each of the Libertarian Party's constitutional challenges under the Anderson / Burdick balancing framework.\nII. Right to Access the Ballot\nIt was long ago established that a state may condition ballot placement on a \"preliminary showing of a significant modicum of support.\" Jenness v. Fortson , 403 U.S. 431, 442, 91 S.Ct. 1970, 29 L.Ed.2d 554 (1971). And there is no dispute that a state may require a candidate to demonstrate support from slightly, but not \"substantially,\" more than 5% of voters without imposing a severe burden triggering heightened scrutiny. Storer , 415 U.S. at 739-40, 94 S.Ct. 1274 ; see Jenness , 403 U.S. at 442, 91 S.Ct. 1970 ; Williams v. Rhodes , 393 U.S. 23, 24-25, 89 S.Ct. 5, 21 L.Ed.2d 24 (1968) (invalidating 15% requirement). The Libertarian Party contends that Arizona law imposes an impermissibly high signature burden, reaching as high as 30% for certain candidates. Yet, the threshold-and dispositive-question is which pool of voters we should consider when measuring this showing.\nUnder Arizona law, all qualified signers-Libertarian Party members, unaffiliated registered voters, and new party members-are eligible to participate in the Libertarian Party primary and to sign a Libertarian Party nominating petition. By its very terms, the statute never requires signatures from more than 1% of these voters. However, by choice, the Libertarian Party has barred non-members from voting in its primary-under party policy, only members can vote in the primary. And it does not want its candidates to solicit signatures from non-members; as a consequence, Libertarian candidates must submit signatures equal to 11% to 30% of party membership in their jurisdiction to qualify for the primary ballot. Thus, our dilemma: is the \"significant modicum of support\" measured against all voters eligible under state law to sign a nominating petition and participate in the primary? Or do we factor in a party's decision to exclude certain eligible voters from its primary and instead consider the resulting, significantly circumscribed pool?\nThe Supreme Court has never expressly answered this question, but its framework in ballot access cases is instructive. The state laws challenged in Norman , Jenness , and Williams required candidates and parties seeking placement on the general election ballot to submit signatures from registered voters equaling a designated percentage of the general election electorate. The Court's approach in these cases was straightforward: it determined whether the required signatures represented a reasonable share of the voters eligible to participate in the upcoming election. See Norman , 502 U.S. at 295, 112 S.Ct. 698 ; Jenness , 403 U.S. at 438-40, 442, 91 S.Ct. 1970 ; Williams , 393 U.S. at 24-25, 30-34, 89 S.Ct. 5. In American Party of Texas and Storer , the state laws imposed similar requirements, with an additional limitation: a voter who participated in another party's primary or convention or signed another candidate's petition was ineligible to sign a nominating petition. In both cases, the Court determined whether the required signatures represented a reasonable share of the \"available pool\" of signers, i.e., voters who had not disqualified themselves by participating in another primary or convention or by signing a previous petition. Storer , 415 U.S. at 739-40, 94 S.Ct. 1274 ; see Am. Party , 415 U.S. at 774-91, 94 S.Ct. 1296.\nIn each of these cases, the Court asked whether the required signatures constituted an unfairly large percentage of those voters eligible under state law to offer their signatures. There was no adjustment to account for the significant portion of this pool comprised of registered members of other parties, many of whom, it can be reasonably presumed, were unlikely to help nominate a competing candidate or party. Nor was there any suggestion that a candidate should be limited to seeking signatures from voters who have already pledged their support to the candidate or his party or cause. Rather, the Court time and again affirmed that requiring a demonstration of \"significant, measurable quantum of community support\" does not impose a severe burden. Am. Party , 415 U.S. at 782, 94 S.Ct. 1296.\nWe invoked a similar analysis in Nader v. Cronin , 620 F.3d 1214, 1217 (9th Cir. 2010). And we do so again here. Arizona law permits all qualified signers- Libertarian Party members, new party members, and registered unaffiliated voters-to sign a Libertarian candidate's nominating petition and to vote in the Libertarian primary. However, qualified signers who already signed another candidate's nominating petition are excluded from the \"available pool\" of voters able to sign a Libertarian candidate's petition.\nNo evidence suggests that, in practice, the statute's (at most) 1% signature requirement even approaches 5% of this remaining pool of eligible signers. It falls upon the Libertarian Party to demonstrate that Arizona imposes a severe burden, and it has failed to do so here. The party's policy choice to exclude all non-members from its primary and its preference to obtain signatures only from party members do not change the calculus. To hold otherwise would permit a party to determine the number of signatures required by manipulating its nominating petition and primary voting requirements. At the same time, the Libertarian Party's proposed rule would incentivize parties to have fewer registered members and therefore artificially reduce the signature requirements. Just as important: where, in this scheme, is the offensive state action? There is no question that the signature requirement would be constitutional if the Libertarian Party permitted non-members to vote in its primary. A political party cannot manipulate its internal preferences and processes to transform a constitutional statute into an unconstitutional one.\nCrucially, Arizona law does not impose any other requirements, such as a strict time period for signature collection, that might nonetheless render the 1% requirement \"an impossible burden\" or \"an impractical undertaking.\" Storer , 415 U.S. at 740, 94 S.Ct. 1274 (requiring 1,000 canvassers to collect 14 signatures each day for 24 days likely imposes a modest burden); see Clingman , 544 U.S. at 589-90, 125 S.Ct. 2029 (limiting a party's internal structure, decision-making processes, and ability to communicate with the electorate likely imposes a severe burden); Timmons , 520 U.S. at 363, 117 S.Ct. 1364 (same); Anderson , 460 U.S. at 790-94, 103 S.Ct. 1564 (requiring an independent candidate to file several months before party conventions imposes severe burden); Am. Party , 415 U.S. at 778-81, 94 S.Ct. 1296 (requiring all signatures to be notarized and submitted in 55-day period does not impose severe burden); Jenness , 403 U.S. at 434, 438, 91 S.Ct. 1970 (permitting 180 days for collection of nominating signatures and requiring submission of signatures five months before election does not impose severe burden); Williams , 393 U.S. at 24-25 & n.1, 89 S.Ct. 5 (conditioning minor party's ballot access on formation of statewide and county-level party committees, participation in a national party convention, and submission of nominating signatures by an early deadline exclusively from voters who never voted in a previous election imposes significant burden). To the contrary, Arizona permits candidates to solicit and submit signatures through an easy-to-use and streamlined online portal. A candidate collecting hand-written signatures must, in practice, collect more than the minimum number of signatures required because, inevitably, some will be deemed ineligible. In contrast, signatures submitted through the online portal are instantaneously verified, thereby reducing the need to submit signatures above the threshold.\nThe limited evidence describing the Libertarian Party's modest efforts to mobilize voters and several candidates' unsuccessful write-in campaigns fails to establish that, in practice, Arizona law \"imposes insurmountable obstacles\" to getting on the primary ballot. Am. Party , 415 U.S. at 784, 94 S.Ct. 1296. Nor does the simple fact that the Libertarian Party had more candidates on past primary and general election ballots reflect such an obstacle under the amended rules. See Munro v. Socialist Workers Party , 479 U.S. 189, 196-97, 107 S.Ct. 533, 93 L.Ed.2d 499 (1986). Accordingly, we apply \"less exacting\" scrutiny because Arizona law imposes a minimal burden on the Libertarian Party's right to access the primary ballot. Timmons , 520 U.S. at 358, 117 S.Ct. 1364 ; see Cronin , 620 F.3d at 1218.\nWe now turn to whether Arizona has an \"important regulatory interest\" that justifies this modest burden. Timmons , 520 U.S. at 358, 117 S.Ct. 1364 (quoting Burdick , 504 U.S. at 434, 112 S.Ct. 2059 ). Arizona's asserted interests in preventing voter confusion, ballot overcrowding, and frivolous candidacies are important interests that have justified equally, if not more, burdensome general election ballot restrictions. See Munro , 479 U.S. at 194-95, 107 S.Ct. 533. These interests are also important in the primary context, given the \"obvious and strong interconnection\" between primary and general elections, which together operate as a \"single instrumentality for choice of officers.\" Pub. Integrity All., Inc. v. City of Tucson , 836 F.3d 1019, 1026 (9th Cir. 2016) (quoting Smith v. Allwright , 321 U.S. 649, 660, 64 S.Ct. 757, 88 L.Ed. 987 (1944) ); see Storer , 415 U.S. at 735, 94 S.Ct. 1274 (A primary election \"functions to winnow out and finally reject all but the chosen candidates.\"). Conditioning primary ballot placement on a demonstration of significant community support advances Arizona's interests in the administration of its primary and general elections. See Anderson , 460 U.S. at 788-89, 103 S.Ct. 1564 ; see also Jenness , 403 U.S. at 442, 91 S.Ct. 1970 ; Munro , 479 U.S. at 193-94, 107 S.Ct. 533.\nBecause we neither require \"a particularized showing of the existence of voter confusion, ballot overcrowding, or the presence of frivolous candidacies,\" Munro , 479 U.S. at 194-95, 107 S.Ct. 533, nor proof that ballot rules are \"the only or the best way to further the proffered interests,\" Dudum v. Arntz , 640 F.3d 1098, 1114 (9th Cir. 2011), Arizona has easily met its burden. The primary signature requirements reasonably further Arizona's important regulatory interests and therefore justify a modest burden on the Libertarian Party's right to ballot access.\nIII. Right to Free Association\nThe Libertarian Party contends that Arizona law infringes upon its right to free association by effectively requiring its candidates to solicit signatures from non-members. Although the Constitution protects a political party's right to not associate with non-members, that right has its limits. U.S. Civil Serv. Comm'n v. Nat'l Ass'n of Letter Carriers, AFL-CIO , 413 U.S. 548, 567, 93 S.Ct. 2880, 37 L.Ed.2d 796 (1973). We first ask whether Arizona in any way \"forces\" the Libertarian Party to associate with non-members. Cal. Democratic Party v. Jones , 530 U.S. 567, 577, 581-82, 586, 120 S.Ct. 2402, 147 L.Ed.2d 502 (2000). If so, we then consider whether such forced association creates a \"risk that nonparty members will skew either primary results or candidates' positions.\" Ariz. Libertarian Party, Inc. v. Bayless , 351 F.3d 1277, 1282 (9th Cir. 2003). We answer both questions in the negative.\nUnlike the state laws at issue in Jones and Bayless , Arizona law permits political parties to exclude non-members from voting in their primaries. At their option, Libertarian candidates may use signatures from non-party members to qualify for the primary ballot-but Arizona law does not require them to do so. Soliciting non-member signatures would seemingly prove helpful in placing more candidates on the primary ballot, but it is the Libertarian Party's modest membership, not a \"state-imposed restriction on [its] freedom of association,\" that imposes upon it this \"hard choice.\" Jones , 530 U.S. at 584, 120 S.Ct. 2402.\nWe acknowledge, without deciding, that there may be some point where the ratio between party members and required signatures constitutes de facto forced association with non-members. For example, if the signature requirement exceeded the number of party members, then a candidate necessarily would, as a matter of arithmetic, have to solicit non-member signatures to qualify for the ballot. But we face no such situation here. Libertarian candidates can qualify for the primary ballot with signatures from 11% to 30% of party members in their jurisdictions, and no evidence suggests it is impossible to do so as a practical matter. Even if collecting these signatures is difficult, we expect \"[h]ard work and sacrifice by dedicated volunteers\" in the operation of \"any political organization.\" Am. Party , 415 U.S. at 787, 94 S.Ct. 1296. Such expectations do not in any way \"force\" Libertarian candidates or voters to associate with non-members.\nNor has the Libertarian Party demonstrated that the solicitation and submission of some non-member signatures \"will skew either primary results or candidates' positions.\" Bayless , 351 F.3d at 1282. We decline to embrace such a speculative conclusion. Any burden on the Libertarian Party's associational freedom is modest, so we again apply less exacting scrutiny and, as above, credit Arizona's important interests to justify these reasonable requirements. See Timmons , 520 U.S. at 358, 117 S.Ct. 1364.\nIV. Equal Protection\nFinally, the Libertarian Party contends that the signature requirements violate equal protection because they impose lesser burdens on other parties. The Libertarian, Democratic, and Republican Parties are all established parties subject to the same statutory requirements. Although, on its face, Arizona law treats them identically, we look to see whether the requirements provide \"a real and essentially equal opportunity for ballot qualification.\" Am. Party , 415 U.S. at 788, 94 S.Ct. 1296. That standard is clearly satisfied here. A Libertarian candidate vying for the primary ballot actually faces a significantly lower burden than his Democratic and Republican counterparts. For example, a statewide Libertarian candidate needs to submit approximately 3,200 signatures, compared to 6,000 and 6,400 signatures for the Democratic and Republican competitors, respectively. See Ariz. Rev. Stat. \u00a7 16-322(A)(1) ; Ariz. Sec. of State, Voter Registration & Historical Election Data , https://azsos.gov/elections/voter-registration-historical-election-data (last visited May 7, 2019).\nThat a Libertarian candidate must submit signatures representing a higher percentage of his party membership than a Democratic or Republican candidate is a consequence of the Libertarian Party's modest size, not a fatal flaw of the statutory scheme. The Supreme Court has indicated that an analogous imbalance lacks constitutional significance. In Illinois State Board of Elections v. Socialist Workers Party , the Court struck down on equal protection grounds a state law requiring local candidates to submit substantially more signatures to qualify for the ballot than statewide candidates. 440 U.S. 173, 186-87, 99 S.Ct. 983, 59 L.Ed.2d 230 (1979). The remedy: imposing the same, 25,000 signature requirement for both local and statewide candidates, even though the eligible voter pool for statewide candidates was six times larger than the pool for certain local candidates. See id. at 183-87, 99 S.Ct. 983. If such an outcome comports with equal protection, then surely so does the situation here.\nEven if we assume that the signature requirements impose a marginally higher burden on the Libertarian Party, that additional burden is far from severe. Cf. Williams , 393 U.S. at 25, 89 S.Ct. 5 (striking down state law that imposed \"substantially smaller burdens\" on certain parties, while making it \"virtually impossible\" for others to place a candidate on the ballot). Under less exacting scrutiny, we again conclude that the same important regulatory interests justify the signature requirements. In setting the threshold for a \"significant modicum of support,\" Jenness , 403 U.S. at 442, 91 S.Ct. 1970, a state must use either an absolute number of voters or a percentage of some group. Not only is it mathematically impossible to craft a statute where the burden on each party is identical under both measurements, Arizona has no obligation to seek such precision. See Dudum , 640 F.3d at 1114 (recognizing regulations need not be \"narrowly tailored\"). Nor was Arizona required to replicate or fold in the preexisting burdens on each party when it amended the ballot access rules in 2015. Cf. Ohio Democratic Party v. Husted , 834 F.3d 620, 623 (6th Cir. 2016) (rejecting an argument \"creat[ing] a 'one-way ratchet' that would discourage states from\" increasing ballot access, \"lest they be prohibited by federal courts from later modifying their election procedures in response to changing circumstances\"). Arizona's choice to set the threshold as a percentage of qualified signers for each established party was neither discriminatory nor unreasonable.\nArizona opted to apply these signature requirements for all parties that have a significant membership and therefore exempt such parties from the quadrennial party-wide re-certification requirements imposed on new parties. This policy affords significant benefits to all established parties and furthers the state's interests in avoiding voter confusion, minimizing clutter on the primary and general ballots, and eliminating frivolous candidacies.\nWe likewise observe no equal protection issue in Arizona's treatment of the Green Party, a new party subject to different statutory requirements. When, as here, we \"examin[e] differing treatments of [different types of political parties], ... [i]n determining the nature and magnitude of the burden that [the state's] election procedures impose on the [complaining party], we must examine the entire scheme regulating ballot access.\" Cronin , 620 F.3d at 1217 (internal quotations and citation omitted). Equal protection is violated when one set of requirements is \"inherently\" or \"invidiously\" more burdensome than the other. Am. Party , 415 U.S. at 781, 94 S.Ct. 1296 ; Jenness , 403 U.S. at 440-41, 91 S.Ct. 1970 ; Cronin , 620 F.3d at 1218-19.\nThe Libertarian Party's chief complaint is that Green Party candidates qualified for the 2016 primary ballot with significantly fewer signatures than Libertarian candidates for the same races. This argument fails to account for the significant quadrennial re-filing burden placed on the Green Party to retain its new party status. Every four years, the Green Party, which currently boasts less than 6,500 members, must submit more than 20,000 signatures for its candidates to be eligible to pursue placement on the ballot. That is, signatures from three times more voters than it has registered members. Meeting the re-filing requirements is \"an all-consuming endeavor\" for the Green Party, which relies on \"a core group of about 10 volunteers\" to work \"every weekend on Saturdays and Sundays for several hours each\" for more than a year. It is only once this step is complete that the modest individual candidate signature thresholds apply. Thus, it is obvious that the primary ballot signature requirements for the Libertarian Party are not \"inherently\" or \"invidiously\" more burdensome than those imposed on the Green Party. Am. Party , 415 U.S. at 781, 94 S.Ct. 1296 ; Jenness , 403 U.S. at 440-41, 91 S.Ct. 1970. To be sure, \"[t]he procedures are different, but the Equal Protection Clause does not necessarily forbid the one in preference to the other.\" Am. Party , 415 U.S. at 781-82, 94 S.Ct. 1296.\nCONCLUSION\nArizona has no \"constitutional imperative to reduce voter apathy or to 'handicap' an unpopular [party] to increase the likelihood that [its] candidate[s] will\" qualify for the primary ballot. Munro , 479 U.S. at 198, 107 S.Ct. 533. The state's signature requirements are reasonable restrictions that impose, at most, a modest burden on the Libertarian Party's First and Fourteenth Amendment rights, while directly advancing Arizona's important regulatory interests. The district court correctly granted summary judgment to the Secretary.\nAFFIRMED.\nThe Libertarian Party satisfies the voter registration requirement, and the Democratic and Republican Parties satisfy both requirements. As of January 1, 2019, Arizona had 1.31 million registered Republicans, 1.17 million registered Democrats, and 32,056 registered Libertarians. Ariz. Sec. of State, Voter Registration & Historical Election Data , https://azsos.gov/elections/voter-registration-historical-election-data (last visited May 7, 2019).\nA voter may only sign one nominating petition per office per election, unless more than one candidate is to be elected to that office. Ariz. Rev. Stat. \u00a7 16-321(A).\nAs of January 1, 2019, Arizona had 1.25 million unaffiliated registered voters. Ariz. Sec. of State, Voter Registration & Historical Election Data , https://azsos.gov/elections/voter-registration-historical-election-data (last visited May 7, 2019).\nAs of January 1, 2019, the Green Party had 6,450 registered members in Arizona. Ariz. Sec. of State, Voter Registration & Historical Election Data , https://azsos.gov/elections/voter-registration-historical-election-data (last visited May 7, 2019).\nA state may not keep a party from welcoming unaffiliated voters to participate in its primary, Tashjian v. Republican Party of Conn ., 479 U.S. 208, 213-29, 107 S.Ct. 544, 93 L.Ed.2d 514 (1986), though it may prohibit party members from participating in another party's primary. Clingman v. Beaver , 544 U.S. 581, 586-97, 125 S.Ct. 2029, 161 L.Ed.2d 920 (2005).\nThe Libertarian Party also contends that the statute violates its right to create and establish a political party. See Norman v. Reed , 502 U.S. 279, 288, 112 S.Ct. 698, 116 L.Ed.2d 711 (1992). This claim merely recites the right to access the ballot claim, and it fails for the same reasons. See infra pp. 1090-94.\nThe Libertarian Party also appeals the district court's exclusion of certain evidence. That issue is moot because summary judgment for the Secretary is warranted even if we consider the excluded evidence.\nThe laws challenged in Norman and Williams approximated the electorate by reference to the number of voters who participated in the preceding general election. Norman , 502 U.S. at 282 n.2, 112 S.Ct. 698 ; Williams , 393 U.S. at 24-25, 89 S.Ct. 5. The law challenged in Jenness approximated the electorate by reference to the number of registered voters during the previous general election. 403 U.S. at 432-33, 91 S.Ct. 1970.\nAm. Party of Tex. v. White , 415 U.S. 767, 94 S.Ct. 1296, 39 L.Ed.2d 744 (1974).\nLike the laws challenged in Norman and Williams , those at issue in American Party of Texas and Storer approximated the electorate by reference to the number of voters who participated in the preceding general election. Am. Party , 415 U.S. at 774-75 & nn.6-7, 94 S.Ct. 1296 ; Storer , 415 U.S. at 726-27, 739-40, 94 S.Ct. 1274.\nNeither of the cases cited by the Libertarian Party persuades us otherwise. One addressed a law that made it \"impossible either absolutely ... or practically\" for a candidate to meet a signature requirement. See Consumer Party v. Davis , 633 F. Supp. 877, 883 (E.D. Pa. 1986). The other struck down signature requirements because they imposed disparate requirements on similarly situated parties that were, the state conceded, impossible to justify. In re Candidacy of Indep. Party Candidates v. Kiffmeyer , 688 N.W.2d 854, 859-61 (Minn. 2004).\nIn Jenness , the Supreme Court noted that, for an independent or minor party candidate seeking \"signatures of 5% of the eligible electorate[,] ... the way is open [because] Georgia imposes no suffocating restrictions whatever upon the free circulation of nominating petitions.\" 403 U.S. at 438, 91 S.Ct. 1970. The Court identified various limitations on signature collection that could be, but were not, imposed under Georgia law. Id. at 438-39, 91 S.Ct. 1970. That a minor party candidate would likely obtain signatures from non-party members was presupposed by the Court, not as a bug of this system, but as a positive feature. Id.\nDespite their differences, we assume, without deciding, that the Libertarian Party is similarly situated to the Democratic, Republican, and Green Parties and that the Equal Protection Clause applies. See Cronin , 620 F.3d at 1218.\nOf course, the signature ratio between parties varies within each political subdivision, as voters are not perfectly distributed throughout the state. The statewide figures are sufficiently representative for our purposes.\nThe Libertarian Party's reliance on Kiffmeyer is, once again, unpersuasive. There, two minor political parties were subject to the same ballot access rules; under those rules, one party had all of its candidates placed on the general election ballot, and the other had none on the ballot, even though the latter received significantly more votes in the primary. Kiffmeyer , 688 N.W.2d at 859-61. Minnesota conceded that these rules were arbitrary and lacked any \"rational ... purpose.\" Id. at 861.\nThe Libertarian Party also complains that a write-in new party candidate automatically qualifies for the general election ballot by winning his primary, while a write-in established party candidate only qualifies for the general election ballot if he wins his primary with votes equaling the number of signatures needed to qualify for the primary ballot. See Ariz. Rev. Stat. \u00a7 16-645(D)-(E). Because the Libertarian Party expressly disclaims any challenge to Arizona's general election ballot access requirements, we do not consider this argument.",
        "type": "majority",
        "author": "McKEOWN, Circuit Judge:"
      }
    ],
    "attorneys": [
      "Oliver B. Hall (argued), Center for Competitive Democracy, Washington, D.C., for Plaintiffs-Appellants.",
      "Kara M. Karlson (argued) and Joseph E. La Rue, Assistant Attorneys General; Mark Brnovich, Attorney General; Office of the Attorney General, Phoenix, Arizona; for Defendant-Appellee."
    ],
    "corrections": "",
    "head_matter": "ARIZONA LIBERTARIAN PARTY ; Michael Kielsky, Plaintiffs-Appellants,\nv.\nKatie HOBBS, in her official capacity as Secretary of State of Arizona, Defendant-Appellee.\nNo. 17-16491\nUnited States Court of Appeals, Ninth Circuit.\nArgued and Submitted March 12, 2019 San Francisco, California\nFiled May 31, 2019\nOliver B. Hall (argued), Center for Competitive Democracy, Washington, D.C., for Plaintiffs-Appellants.\nKara M. Karlson (argued) and Joseph E. La Rue, Assistant Attorneys General; Mark Brnovich, Attorney General; Office of the Attorney General, Phoenix, Arizona; for Defendant-Appellee.\nBefore: J. Clifford Wallace, A. Wallace Tashima, and M. Margaret McKeown, Circuit Judges."
  },
  "file_name": "1085-01",
  "first_page_order": 1085,
  "last_page_order": 1097
}